{
  "$schema": "../character.schema.json",
  "assets": {
    "relaxed": "/assets/characters/lappland-the-decadenza-relaxed.png",
    "conflicted": "/assets/characters/lappland-the-decadenza-conflicted.png",
    "mocking": "/assets/characters/lappland-the-decadenza-mocking.png",
    "threatened": "/assets/characters/lappland-the-decadenza-threatened.png",
    "staffRevolver": "/assets/characters/staff-revolver-7mm.png",
    "unconscious": "/assets/characters/lappland-the-decadenza-unconscious-reclined.png",
    "defeatedSummary": "/assets/characters/lappland-the-decadenza-defeated-summary-chair.png"
  },
  "profile": {
    "description": "来自叙拉古的孤狼，如今似乎已经连“孤狼”这个称呼也不怎么在意了。拉普兰德没有需要奇迹挽回的人，也没有非实现不可的宏愿——她只是听说，高位面的策展人在古堡里摆了一张真正会死人的赌桌：二十一点决定谁向左轮里装弹，最后活下来的人还能向主人索取一个愿望。她觉得这听起来相当有趣，于是欣然接受邀请，甚至颇为满意地换上了策展人为她准备的礼服。至于获胜后究竟想要什么？她还没决定。毕竟，比愿望更难得的，是一场结局连她自己都猜不到的游戏。"
  },
  "trophyDossier": {
    "title": "人物档案",
    "recordLabel": "档案 // 07",
    "openLabel": "档案",
    "closeLabel": "收起",
    "fields": [
      { "id": "name", "label": "姓名", "value": "拉普兰德" },
      { "id": "race", "label": "种族", "value": "鲁珀" },
      { "id": "gender", "label": "性别", "value": "女" },
      { "id": "tier", "label": "评级", "value": "S" },
      { "id": "weight", "label": "重量", "value": "未记录" },
      { "id": "virginity", "label": "处女性", "value": "未核验" }
    ],
    "condition": { "label": "尸体状况", "description": "确认死亡；遗体已完成初步收容，礼服与随身饰件保存完整。" }
  },
  "matchSummary": {
    "playerVictory": "枪声落下，拉普兰德向后倒进椅背。刚才还饶有兴致注视着牌桌的银灰色眼睛终于失去了神采，嘴角却仍残留着一点若有若无的笑意。直到最后，她也没等到那个出乎所有人意料的结局——或者说，这声枪响本身就是了。",
    "playerDefeat": "最后一声枪响击中了天花板。拉普兰德安静了片刻，随后笑着把面前的牌推开。面对那个足以实现任何愿望的承诺，她似乎第一次认真思考了几秒：‘愿望啊……那就下一场让我来定规则吧。你不会反悔的，对吧，策展人？’",
    "escaped": "策展人突然离席。拉普兰德没有追上来，只是托着下巴看了看空荡荡的座位，又看了看尚未结束的牌局：‘这样就散场？真可惜。我还以为高位面的人会更懂得尊重演出呢。’"
  },
  "infoBar": {
    "sourceAbilityId": "carnival-index",
    "label": "狂欢指标",
    "description": "狂欢指标初始为0，并在每轮结束后替换为策展人该轮最终显示点数。本轮普通点数比较时，策展人达到指标会获得1点优势，否则拉普兰德获得2点优势；拉普兰德达到指标后，双方爆牌上限提高2点。",
    "value": {
      "type": "number",
      "value": {
        "type": "status-stacks",
        "target": "owner",
        "statusDefinitionId": "carnival-index-value"
      }
    }
  },
  "trophyGallery": {
    "headshot": "/assets/characters/lappland-the-decadenza-trophy-gallery-headshot.png",
    "fullBody": "/assets/characters/lappland-the-decadenza-trophy-gallery-full-subject.png",
    "poses": [
      {
        "id": "left",
        "name": "左侧",
        "image": "/assets/characters/lappland-the-decadenza-trophy-gallery-left-subject.png"
      },
      {
        "id": "prone",
        "name": "俯卧",
        "image": "/assets/characters/lappland-the-decadenza-trophy-gallery-prone-subject.png"
      },
      {
        "id": "right",
        "name": "右侧",
        "image": "/assets/characters/lappland-the-decadenza-trophy-gallery-right-subject.png"
      }
    ],
    "closeups": [
      {
        "id": "face-inspected",
        "name": "落幕后的神情",
        "x": 50,
        "y": 15,
        "image": "/assets/characters/lappland-the-decadenza-trophy-detail-face-inspected.png",
        "description": "银白长发与鲁珀耳朵仍保持着熟悉的轮廓，闭合的双眼和安静的神情却宣告这场意外频出的演出已经彻底落幕。"
      },
      {
        "id": "chest-tie",
        "name": "礼服领结",
        "x": 51,
        "y": 29,
        "image": "/assets/characters/lappland-the-decadenza-trophy-detail-chest-tie.png",
        "description": "黑色高领、银灰胸饰与红蓝领带叠成礼服最醒目的中心，细小链饰在陈列舱灯光下仍清楚可辨。"
      },
      {
        "id": "skirt-thigh",
        "name": "裙摆与腿环",
        "x": 50,
        "y": 51,
        "image": "/assets/characters/lappland-the-decadenza-trophy-detail-skirt-thigh.png",
        "description": "黑色裙摆露出内层的红蓝纹样，金属扣件固定着带有金色纹章的黑色腿环，与披肩配色彼此呼应。"
      },
      {
        "id": "feet",
        "name": "长靴与短袜",
        "x": 50,
        "y": 88,
        "image": "/assets/characters/lappland-the-decadenza-trophy-detail-feet-boots-p0.png",
        "description": "黑色长靴以银色狼首扣件、交叉鞋带和厚实鞋底延续礼服的锐利轮廓，完整记录了她赴宴时的足部装备。",
        "variants": [
          {
            "image": "/assets/characters/lappland-the-decadenza-trophy-detail-feet-white-socks.png",
            "description": "长靴被移开后，白色罗纹短袜与黑色软垫形成鲜明对比，作为礼服足部结构的补充档案被单独记录。"
          }
        ]
      }
    ]
  },
  "revolverPlacement": {
    "top": 140,
    "left": 124,
    "mobileTop": 110,
    "mobileLeft": 112
  },
  "ai": {
    "P": 0,
    "A": 1,
    "B": 1,
    "C": 1
  },
  "aiSkills": [
    { "definitionId": "carnival-index", "enabled": true, "parameters": {} },
    { "definitionId": "carnival-heats-up", "enabled": true, "parameters": {} }
  ],
  "dialogue": {
    "MATCH_START": [
      "二十一点、左轮，还有一个什么都能实现的愿望……嗯，邀请函没有夸张。很好，我开始喜欢这里了。",
      "策展人，你特意把我叫到这里，总不会只是想看我规规矩矩地打牌吧？……哈哈，别紧张，我会遵守规则的。至少在它还让我觉得有趣的时候。",
      "在叙拉古，坐上赌桌的人通常都觉得自己能赢。然后他们开始借钱、拔枪、求饶……你这里会进行到哪一步？我很期待。",
      "放心，我没有什么非赢不可的理由。所以啊——你最好认真一点。没有退路的人反而容易猜，像我这样的才麻烦，不是吗？",
      "愿望先放在那里吧。要是连这场游戏都不能让我满意，拿到奖品又有什么意思？发牌。",
      "礼服不错，酒也不错，现在只差一点意外了。策展人，今晚可别让我失望。"
    ],
    "PLAYER_HIT": [
      "还要？呵……很好。刚才那一瞬间，你明明犹豫了。",
      "再摸一张。不错，我还以为你会选择那个最安全、也最无聊的答案。",
      "你在等我劝你停吗？那可不行。自己的选择，当然要自己毁掉才有意思。",
      "手已经伸出去了，就别看我了。下一张牌可不会因为你后悔就自己爬回牌堆。",
      "哈哈，继续。就是这种时候最好看——人总是在决定冒险之后，才突然想起风险是什么。",
      "再来一张？好啊。我现在开始有点想知道，你究竟是勇敢，还是只是不愿意在我面前退一步。"
    ],
    "PLAYER_STAND": [
      "停了？嗯……比我想象得早一点。",
      "这么快就满足了？可以。那就坐好，看我怎么处理你留下来的麻烦。",
      "把选择交给我了啊。谢谢你的信任，策展人。",
      "知道什么时候收手，当然是一种本事。不过有时候，后悔也是从收手之后才开始的。",
      "不再摸牌……很好。现在你的点数不会再变了，你的表情倒是还会。",
      "Stand？真稳妥。别误会，我不是在夸你，我只是在想该怎么让这个决定变得有趣一点。"
    ],
    "OPPONENT_FIRST_HIT": [
      "再给我一张。放心，我还没玩够。",
      "Hit。既然牌堆里还藏着答案，为什么要这么早停下来？",
      "一张牌而已。要是真能把我送到枪口下面，那不是更有意思吗？",
      "发牌吧。猜已经翻开的牌可没什么意思，我喜欢还没看见的那一张。",
      "当然继续。策展人，你不会已经开始替我担心了吧？"
    ],
    "OPPONENT_FIRST_STAND": [
      "我停。怎么，很意外？",
      "就这样吧。偶尔克制一点，才能让别人更紧张。",
      "Stand。接下来轮到你猜，我到底拿到了什么。",
      "够了。一直向前冲可不叫疯狂，那只是不会思考。",
      "不摸了。别露出那种失望的表情，我只是想看看你接下来怎么办。"
    ],
    "OPPONENT_REPEAT_HIT_AFTER_PLAYER_STAND": [
      "你已经坐稳了？那我只好继续往前走了。再来一张。",
      "再发。你的答案已经写好了，我的还没有。",
      "哈哈，这下有意思了。你不能再改，我却还可以。",
      "继续。我很想看看，是我的牌先追上你，还是我先把自己送到枪口下面。",
      "发牌员，别停。策展人难得这么安静，总得有人让桌面热闹一点。"
    ],
    "PLAYER_BLACKJACK": [
      "黑杰克。漂亮。两张牌就把我推到枪口前面……这种开场我喜欢。",
      "二十一。哈哈，策展人，你今晚似乎比我更会制造意外。",
      "两颗实弹？很好。一下子就把气氛推起来了。",
      "完美的起手。别急着得意，我只是突然更期待轮盘那一段了。",
      "黑杰克啊……原来如此。看来今晚第一个精彩的场面是你送给我的。"
    ],
    "OPPONENT_BLACKJACK": [
      "二十一。哈，真方便，连选择都替我省了。",
      "黑杰克。策展人，两颗子弹归你。虽然它们最后只会飞向天花板……还是挺有仪式感的。",
      "看来牌很喜欢我。放心，我暂时不会因此变得自大——暂时。",
      "两张就结束了？有点快。不过看到你的表情之后，我又觉得这结果还不错。",
      "黑杰克。发牌员，上弹吧。好戏总得有人先把灯点亮。"
    ],
    "PLAYER_BUST": [
      "超过二十一了。啊……原来你刚才不是勇敢。",
      "爆牌。真可惜，我还想看看你能把那点贪心藏多久。",
      "多了一张。就是这样，有些错误只有发生以后才显得特别明显。",
      "哈哈，策展人，你刚才伸手的时候可不像现在这么后悔。",
      "爆了。别看牌堆，它可没有逼你抽那一张。"
    ],
    "OPPONENT_BUST": [
      "啊，爆牌了。哈哈……很好，至少不是个无聊的错误。",
      "超过二十一。看来这次是我把手伸得太远了。",
      "啧，真遗憾。发牌员，把子弹装进去吧，愿赌服输。",
      "原来是这一张。嗯，我刚才确实没猜到——这就够了。",
      "爆牌。策展人，别这么高兴，我只是替接下来的轮盘添了点东西。"
    ],
    "PLAYER_SURVIVED_TRIGGER": [
      "咔哒。没响……可惜，我刚才还挺期待那声枪响的。",
      "空膛。看来今晚还舍不得让我们散场。",
      "活下来了——虽然你本来就不会死。别急着放松，牌桌还在这里。",
      "没响。哈哈，好吧，那就重新发牌。希望下一轮别这么客气。",
      "又逃过去了。运气这种东西真有礼貌，总喜欢先敲门，再决定什么时候进来。"
    ],
    "OPPONENT_SURVIVED_TRIGGER": [
      "……咔哒。嗯，我还在。",
      "没响。策展人，你刚才是不是稍微有一点失望？",
      "空膛啊。发牌员，枪口可以移开了，我们还有游戏要玩。",
      "哈哈，真遗憾。我刚刚还在想，死在第几轮才算一个漂亮的结局。",
      "看来这颗子弹还不想见我。那就别催它，继续发牌吧。"
    ],
    "PLAYER_WIN_ROUND": [
      "这一手归你。不错，给我的弹仓留个位置吧。",
      "你赢了。嗯……至少这轮没有按照我猜的方向走。",
      "点数比我高。发牌员，装弹。策展人，继续保持这种水平。",
      "很好。赢得这么干净，我都不好意思挑毛病了。",
      "这一局是你的。别笑得太早，真正有意思的东西可不在牌桌上。"
    ],
    "OPPONENT_WIN_ROUND": [
      "我赢了。策展人，你知道接下来该做什么。",
      "这一手归我。来，把那颗子弹放进去，动作漂亮一点。",
      "比你高一点。只差一点往往比差很多更让人不舒服，对吧？",
      "哈哈，看来这一轮是我比较讨牌喜欢。",
      "我拿下了。别露出那种表情，只是一颗子弹而已——而且枪口又没朝着你。"
    ],
    "PUSH_ROUND": [
      "平手。什么都没发生……这可不是我今晚最喜欢的结果。",
      "一样的点数。好吧，再来一次。总不能每一幕都这么精彩。",
      "没有赢家，也没有子弹。真和平啊，和平得让我有点困了。",
      "打平了。策展人，我们是不是太有默契了一点？这样下去会很无聊的。",
      "平局。发牌员，洗牌吧。下一轮最好有人做点错误的决定。"
    ],
    "PLAYER_TRIGGER_READY": [
      "轮到你了。别摆出那副表情，枪口又没有对着你的脑袋。",
      "来吧，扣下去。你设计了这么漂亮的规则，总不能自己破坏气氛。",
      "策展人，手指放好。大家都在等这一声呢。",
      "别犹豫。要是连朝天花板开枪都需要勇气，我可要重新评价这场邀请了。",
      "哈哈，就是这样。让我看看这颗子弹愿不愿意替我赢下今晚。"
    ],
    "OPPONENT_TRIGGER_READY": [
      "轮到我了？好啊。发牌员，把枪拿稳一点。",
      "枪口可以再靠近一些，我想听清楚击锤落下去的声音。",
      "策展人，别移开眼睛。既然邀请我来，总该好好看看游戏的结果。",
      "就是这里。嗯……冰凉的。现在扣吧。",
      "哈哈，你怎么比我还紧张？放心，真响了以后，我大概也没机会怪你。",
      "来吧。要么一声枪响，要么一声空响——不管是哪一个，总比等待有趣。"
    ],
    "PLAYER_TRIGGER_HIT": [
      "响了。哈哈……很好，终于轮到愿望这一段了。",
      "实弹。看来今晚是我赢。愿望啊……让我想想，可不能浪费这么好的机会。",
      "枪声真不错。策展人，你的承诺现在还作数，对吧？",
      "中了。那我想好了——下一场，换我来定一点规则。怎么样？",
      "哈哈哈！就是这个声音。至于愿望……别急，我突然觉得让你等一会儿也很有趣。"
    ],
    "OPPONENT_TRIGGER_HIT": [
      "……哈，原来是这一格——",
      "砰——……真是……漂亮的意外。",
      "……哈哈……这次，猜错了啊。",
      "枪响之后，拉普兰德的话音戛然而止。",
      "她似乎还想笑，却再也没有发出声音。"
    ],
    "SPECIAL_TWENTY_ONE_PUSH": [
      "二十一对二十一。完美得有点过分了……所以，再来。",
      "同样的二十一。哈哈，策展人，这算不算我们一起把游戏玩坏了？",
      "顶点上的平局。很漂亮，可惜没有任何人因此倒霉。",
      "都是二十一。好吧，这一幕我承认值得看第二遍。",
      "谁都没输。真罕见——我居然觉得一个平局还算有趣。"
    ],
    "SPECIAL_LOW_PUSH": [
      "这么低就一起停了？哈哈，你看，我们两个突然都变得很珍惜生命。",
      "低点数平手。谨慎、克制、安全……听起来像三个很适合拿来催眠的词。",
      "谁都没敢再拿一张。策展人，我是不是应该替观众要求退票？",
      "一样的低点数。好吧，这一轮就当中场休息。",
      "两个人同时收手……真有意思。明明都说自己不怕，身体倒是很诚实。"
    ]
  }
}
