{
  "$schema": "../character.schema.json",
  "assets": {
    "relaxed": "/assets/characters/dorothy-relaxed.png",
    "conflicted": "/assets/characters/dorothy-conflicted.png",
    "mocking": "/assets/characters/dorothy-mocking.png",
    "threatened": "/assets/characters/dorothy-threatened.png",
    "staffRevolver": "/assets/characters/staff-revolver-7mm.png",
    "unconscious": "/assets/characters/dorothy-unconscious-reclined.png",
    "defeatedSummary": "/assets/characters/dorothy-defeated-summary-chair.png"
  },
  "profile": {
    "description": "莱茵生命源石技艺应用科前主任，在一次报废自己理想的实验后离开哥伦比亚，以研究员身份加入罗德岛。她温柔得近乎习惯性地照顾周围所有人，即便面对的是一位想取她性命的策展人：她真心实意地在意你的处境，却仿佛从来不把自己的生死放在心上。金色长耳、垂至腰际的淡金发下，是一张坦率而温和的面孔——你会忍不住想，这样的人怎么会坐在死亡赌桌边？而她只会把问题抛回给你。"
  },
  "trophyDossier": {
    "title": "人物档案",
    "recordLabel": "档案 // 09",
    "openLabel": "档案",
    "closeLabel": "收起",
    "fields": [
      {
        "id": "name",
        "label": "姓名",
        "value": "多萝西"
      },
      {
        "id": "race",
        "label": "种族",
        "value": "扎拉克"
      },
      {
        "id": "gender",
        "label": "性别",
        "value": "女"
      },
      {
        "id": "tier",
        "label": "评级",
        "value": "S"
      },
      {
        "id": "weight",
        "label": "重量",
        "value": "49kg"
      },
      {
        "id": "virginity",
        "label": "处女性",
        "value": "是"
      }
    ],
    "condition": {
      "label": "尸体状况",
      "description": "淡金色的长发散落在冰冷的金属台上，子弹从前额射入，把她天才的大脑搅成了一碗豆腐脑，但她的面容仍然平静得像是睡着，只是那对总是认真注视对方的金色眸子，已经变成了两池凝固的琥珀。棕色下摆被尿液浸透贴在腰际，双腿略微分开，她到死都没有失去那副“研究员正在观察什么”的从容神情。若抛开额头的那个骇人伤口，她看起来只是实验室里暂时打盹的主任。只是再也不会有人替她披上外套，再也不会有人在半夜醒来，看见她还亮着的那盏灯。"
    }
  },
  "matchSummary": {
    "playerVictory": "子弹从她的眉心钻入，将那张温和的脸向上微微扬起，她的金发像一片被风吹散的麦浪般向后飘去，身体没有立刻倒下，仿佛在等待听完枪响的回音，然后才不情愿地向后仰面摔进椅子里。她没有发出太响的声音——只有一声短促的的叹息从她喉咙里漏出。\n你安静地等着她的两只大白腿不再抽搐，然后才走了过去，低头看了看她半睁着的眼睛——浑浊的眼珠倒映着天花板上的灯，似乎还在观察什么别人看不见的东西，不过你也不太感兴趣，因为很明显，她的乳沟在这个角度更加能吸引你的注意力。",
    "playerDefeat": "她赢了。\n\n她安静地坐在那里，看了很久自己面前的牌，又看了看你。片刻后，她抬手将一缕滑落的金发拢到耳后，从口袋里翻出一条巧克力棒，剥开锡纸，朝你晃了晃：“要吃一半吗？我请客。刚才我们都很紧张，你恐怕也饿了吧。”\n你没有回应她，只是一直盯着她，直到她走出门去。你看到她在门廊停了一下，手指轻轻按着胸口。的确，她差一点就死在这里了。",
    "escaped": "多萝西没有叫住你。她看着你的背影越来越远，安静地摘下了自己头上的钟形帽，放在身侧的椅子上。\n\n她把帽子和那张黑杰克留下的旧牌一起收好，然后礼貌地向发牌员点点头。也许她应该庆幸在这条时间上，死神不会早早收割她年轻的灵魂，虽然她从来不珍惜自己的生命。"
  },
  "trophyGallery": {
    "headshot": "/assets/characters/dorothy-trophy-gallery-headshot.png",
    "fullBody": "/assets/characters/dorothy-trophy-gallery-full-subject.png",
    "poses": [
      {
        "id": "left",
        "name": "左侧",
        "image": "/assets/characters/dorothy-trophy-gallery-left-subject.png"
      },
      {
        "id": "prone",
        "name": "俯卧",
        "image": "/assets/characters/dorothy-trophy-gallery-prone-subject.png"
      },
      {
        "id": "right",
        "name": "右侧",
        "image": "/assets/characters/dorothy-trophy-gallery-right-subject.png"
      }
    ],
    "closeups": [
      {
        "id": "face-inspected",
        "name": "面部摆弄特写",
        "x": 50,
        "y": 15,
        "image": "/assets/characters/dorothy-trophy-detail-face-inspected.png",
        "description": "被子弹亲吻过的额头微微后仰，嘴唇没有来得及合拢，露出一小截安静的舌尖。你钳着她的下巴抬起她的脸检查时，她像一只尚未完全断电的玩偶，看来她死亡的那一刻似乎仍在思考什么。"
      },
      {
        "id": "chest-costume",
        "name": "束带领口",
        "x": 50,
        "y": 29,
        "image": "/assets/characters/dorothy-trophy-detail-chest-costume.png",
        "description": "看似老实的上衣其实非常大胆，你稍微一波弄，就露出一对随着呼吸早已停止而安静伏着的乳房——她没有穿胸罩，乳晕在灯光下微微收缩，似乎仍残留着一丝对侵犯者的反应。血迹在她乳房间那道最柔软的中线处蜿蜒而下，像一条她曾经不得不走完的那条路。"
      },
      {
        "id": "upper-hem",
        "name": "胯部",
        "x": 50,
        "y": 51,
        "image": "/assets/characters/dorothy-trophy-detail-upper-hem.png",
        "description": "她的裙摆因为倒下的力道往上掀开，露出紧实的大腿，上方没有一丝赘肉，是常年在户外进行实地调研的痕迹。她的尾巴从尾椎处自然延伸——如今这条尾巴只能被摆弄了。你轻轻拨弄尾巴尖，它会随之摆动，仿佛仍在回应你的挑逗。"
      },
      {
        "id": "leg-band",
        "name": "左腿的腿环",
        "x": 58,
        "y": 53,
        "image": "/assets/characters/dorothy-trophy-detail-leg-band.png",
        "description": "黑色的腿环仍牢牢咬在她左大腿上，仿佛不知道主人已经死了。腿环下面是淤青，印证了她死前最后一段时间内，这里就始终处于紧绷状态。"
      },
      {
        "id": "feet",
        "name": "足部特写（脱鞋前）",
        "x": 50,
        "y": 88,
        "image": "/assets/characters/dorothy-trophy-detail-boots-p0.png",
        "description": "一双白色高跟靴，鞋跟约四厘米，鞋面没有任何装饰，不是那种方便在野外出差和行走的款式。鞋底边缘有磨损，后跟更明显——她应该走了很远的路才来到这里。稍微晃动小腿，靴子内发出轻微的空间回音……她的脚汗不多，靴内干燥。整体观感整洁、干爽，只有靠近鞋口处略微泛着一点温热的余味。",
        "variants": [
          {
            "image": "/assets/characters/dorothy-trophy-detail-boots-p1-white-socks.png",
            "description": "剥下高筒靴，一双脚踝纤细、足弓弧度柔和的脚露了出来。她的白色连裤袜贴近脚趾处已有一层薄薄的淡黄——那是她生前脚汗留下的痕迹，干燥而温驯。被袜子包裹的脚趾形状清晰，五根脚趾整齐地压在一起，大趾微微上翘，看来她死前还偷偷用脚用力抠鞋底。"
          }
        ]
      }
    ]
  },
  "revolverPlacement": {
    "top": 140,
    "left": 124,
    "mobileTop": 110,
    "mobileLeft": 112
  },
  "ai": {
    "P": 0,
    "A": 1,
    "B": 1,
    "C": 1
  },
  "aiSkills": [],
  "dialogue": {
    "MATCH_START": [
      "嗯……两张牌。代表未知的一张，和代表已知的一张，很有意思的规则呢。",
      "你不用紧张，我打牌不是很凶的。",
      "唔……拿到牌之前，能先告诉我，你打算用什么样的策略吗？我很好奇。",
      "我不常来这种地方。要是我哪里做错了某个流程的举止，你直接告诉我。",
      "两点了。这个点实验室的灯还亮着吧，等我回去以后我得提醒她们早点休息……",
      "你说，发牌员会因为我是新手而手下留情吗？……不会啊——嗯，只是问一下。"
    ],
    "PLAYER_HIT": [
      "继续要牌呀……你对自己的判断很有信心呢。",
      "嗯，我猜你手上一定很尴尬。17以下？其实……我也常常这样。总觉得再一步就能弥补了。",
      "……还是小牌？你脸上的表情几乎把牌面写在额头上了哦。",
      "希望下一张是甜的呢……唔，我是说牌。不是巧克力。"
    ],
    "PLAYER_STAND": [
      "嗯——那你把选择权交给我了呢。这比赌自己的牌还让人紧张。",
      "我要是不小心追过了……请别用杀我这件事来让我学会稳重。",
      "好，你停牌了。现在压力到我这边来了——我数到三之前你可不可以别看我？开玩笑的。"
    ],
    "OPPONENT_FIRST_HIT": [
      "再给我一张，我需要更多才能做出下一步判断。",
      "我对冒险并不陌生，只是过去我们都有知情同意书的……嗯，我知道。",
      "下一张也许是值得期待的孩子呢。",
      "不继续的话，就永远不知道答案了。"
    ],
    "OPPONENT_FIRST_STAND": [
      "嗯……我不想太贪心。",
      "这手牌虽然不见得能赢，但至少不会让我现在就输掉。",
      "我不太会赌，但算下来，这个点数已经值得我珍惜它了。",
      "停牌。……难得，我竟然做了个保守的决定。"
    ],
    "OPPONENT_REPEAT_HIT_AFTER_PLAYER_STAND": [
      "再一张……我知道这可能有点疯了，但我不想还没尝试过就认输。",
      "这张、这张、这张……说不定我运气真的那么好呢？",
      "我很少指望所谓的奇迹。可是现在……",
      "再来一张，再来一张的话……也许。请你快些发，别让我来得及害怕……"
    ],
    "PLAYER_BLACKJACK": [
      "21点……原来是这样的感觉。好吧，我是有点羡慕这种运气。",
      "这轮我的死掉概率变得更大了吧？……真是运气好得不讲道理。",
      "漂亮。不过，能不能稍微等我一秒，让我做好心理准备？"
    ],
    "OPPONENT_BLACKJACK": [
      "……这是真的吗？我这辈子抽到过最好的一张卡还是食堂的蛋糕兑换券呢。",
      "啊。这大概就是命运偶尔打瞌睡的时候。",
      "我好像……拿到了一副完美的牌呢。"
    ],
    "PLAYER_BUST": [
      "爆牌了？……对不起，我不该松一口气的，这不符合我的伦理。",
      "看起来，我活过了这一轮——谢谢你。",
      "你没有受伤吧？这只是一个游戏……虽然这个游戏有点危险。你别太懊恼，你还是有机会的。",
      "下一次，下次，再多考虑一下概率就好了。"
    ],
    "OPPONENT_BUST": [
      "啊——啊……怎么会是这种感觉。",
      "我赌输了……不，我只是想看看这副牌能变得多大的，怎么会这样。",
      "糟糕。我好像把重要的事情忘记了——现在我要面对枪口了。",
      "哈……我计算得太乐观了。是我的失误。"
    ],
    "PLAYER_WIN_ROUND": [
      "你的点数更高——好的，我接受这个结果。",
      "……愿赌服输。虽然我真的很想回去把那篇论文改完。",
      "你的策略比我好，我该向你学习。",
      "哈——大概是我上一次实验报告里没有感谢资助方，被命运谴责了吧。"
    ],
    "OPPONENT_WIN_ROUND": [
      "是我……对吧？",
      "看来有时候，好运也会眷顾准备充分的人。",
      "这一轮，是我赢了。……但还没有结束吧？",
      "我赢了？……哎呀，我都想好遗言怎么写了……",
      "点数是我大吗？对不起——我刚才太紧张了没有看仔细。总……总之，我活下来了，对吧？"
    ],
    "PUSH_ROUND": [
      "平局。那我们都没有输，也都没有赢——说实话，我觉得自己捡了个便宜。",
      "“咦？…………平局吗。像是拿了个不好不坏的实验结果。",
      "看来我们都不是运气太差的人。",
      "唔，命运真喜欢开玩笑。那就是，下一轮再见了。",
      "双方同点——这概率也不高吧？真想算算看。"
    ],
    "SPECIAL_TWENTY_ONE_PUSH": [
      "哈哈哈哈，这——太有意思了。两个完美21点、双方都直接拿到黑杰克，这概率比中彩票还要低。"
    ],
    "SPECIAL_LOW_PUSH": [
      "我们居然都不肯再冒险了。……真奇怪，这比谁都想拼一把的时候更像赌博——原来我们都怕了"
    ],
    "PLAYER_TRIGGER_READY": [
      "这枪真漂亮啊……",
      "别担心，射向天花板的话……你不会有事的。",
      "如果你害怕的话，就闭上眼睛再扣扳机。……我会替你计数。",
      "需要我回避吗？……没事的。"
    ],
    "OPPONENT_TRIGGER_READY": [
      "……如果我现在说‘我后悔了’，规则会允许我退出吗？——不会啊……",
      "请让我自己数三秒。我需要一点整理思绪的时间……",
      "原来被枪指着，人会更清楚地想起那些没来得及陪的人。",
      "请不要弄脏我的帽子——我还想在接下来的实验里继续戴它。……我知道这不是一个遗言该有的样子，可我现在也想不出来了。",
      "……呐、如果我死了，帮我跟赫默说一下——实验进度全在我的终端里，密码她猜得到的。",
      "“万一我真的没撑过去，也请不要自责。从我坐在这里开始，就是自己选的了。"
    ],
    "PLAYER_SURVIVED_TRIGGER": [
      "看来我们的运气还不坏。",
      "空枪……是因为刚才我把自己内心那句‘别怕’说出口了吗？还是，只是恰好如此。",
      "嗯。好的，我们继续……谢谢你，策展人先生。"
    ],
    "OPPONENT_SURVIVED_TRIGGER": [
      "空枪……啊，这就是活着的感觉。……嗯。比我想象中的，要温暖一点。",
      "咔哒——没有响。没有响，对吧？",
      "……所以我还能回到实验室，把那篇论文写完。",
      "没有洞……好奇怪，我明明感觉自己的脑袋被打穿了"
    ],
    "PLAYER_TRIGGER_HIT": [
      "我应该高兴的。可是坐在这个位置上，我忽然不知道该怎样替那些没有坐到这里的人高兴。"
    ],
    "OPPONENT_TRIGGER_HIT": [
      "嗬……呃……"
    ]
  }
}
