{
  "$schema": "../character.schema.json",
  "assets": {
    "relaxed": "/assets/characters/ho-olheyak-relaxed.png",
    "conflicted": "/assets/characters/ho-olheyak-conflicted.png",
    "mocking": "/assets/characters/ho-olheyak-mocking.png",
    "threatened": "/assets/characters/ho-olheyak-threatened.png",
    "staffRevolver": "/assets/characters/staff-revolver-7mm.png",
    "unconscious": "/assets/characters/ho-olheyak-unconscious-reclined.png",
    "defeatedSummary": "/assets/characters/ho-olheyak-defeated-summary-chair.png"
  },
  "profile": {
    "description": "来自哥伦比亚的历史与文献学者，曾在漫长岁月里追索失落的血脉与旧日的天空。她接受策展人的邀请，不是因为相信命运会宽待任何人，而是想在这场黑杰克与左轮的牌局里，替自己的族群翻开答案：被遗忘的传承，是否仍能替人挡下一次注定的终局。她最不能丢掉的，是把濒临终焉也当作一场值得观察的实验，并在枪响以前保持玩味的笑意。"
  },
  "trophyDossier": {
    "title": "人物档案",
    "recordLabel": "档案 // 08",
    "openLabel": "档案",
    "closeLabel": "收起",
    "fields": [
      { "id": "name", "label": "姓名", "value": "霍尔海雅" },
      { "id": "race", "label": "种族", "value": "黎博利" },
      { "id": "gender", "label": "性别", "value": "女" },
      { "id": "tier", "label": "评级", "value": "S" },
      { "id": "weight", "label": "重量", "value": "61kg" },
      { "id": "virginity", "label": "处女性", "value": "非处女" }
    ],
    "condition": { "label": "尸体状况", "description": "确认死亡，遗体已完成初步收容，服饰与种族特征保存完好，下体有一定程度失禁发生，建议正式收容前进行清理。“啧，看她身上的那些管子，指不定她生前为了活下来给自己用了什么透支自己的药物，现在好了，命运这家伙找上门来了，她却连自己的括约肌都守不住，好好把她收拾干净了吧，说不定还有什么惊喜在等着我们呢，毕竟这娘们身上用的药可太多了，可能有什么稀奇古怪的副作用事后找上门来了呢”。" }
  },
  "matchSummary": {
    "playerVictory": "待补全。",
    "playerDefeat": "听见枪声回荡，霍尔海雅依然保持着富有玩味的笑脸。命运此番将献祭吞下，吐出了胜利的甘甜果实；她知道自己也在祭品之中，不过这次并没有被笑纳。她把牌面合拢：‘看吧，哪怕到了牌桌上，我也依然承袭着祖辈的荣光。现在，请履行我们的赌约。’",
    "escaped": "‘哈，真是无趣，原来您是这样心胸狭隘的人。’霍尔海雅挑衅地看着你，‘您该为了浪费我的时间，支付与我们约定的代价。’"
  },
  "infoBar": {
    "sourceAbilityId": "ho-olheyak-inheritance-terminal",
    "label": "记忆牌",
    "description": "显示霍尔海雅记住的策展人上一轮最后获得的一张牌；首轮尚未形成记忆时暂无。",
    "value": { "type": "card", "source": "status-card", "statusDefinitionId": "ho-olheyak-memory-card" }
  },
  "trophyGallery": {
    "headshot": "/assets/characters/ho-olheyak-trophy-gallery-headshot.png",
    "fullBody": "/assets/characters/ho-olheyak-trophy-gallery-full-subject.png",
    "poses": [
      { "id": "left", "name": "左侧", "image": "/assets/characters/ho-olheyak-trophy-gallery-left-subject.png" },
      { "id": "prone", "name": "俯卧", "image": "/assets/characters/ho-olheyak-trophy-gallery-prone-subject.png" },
      { "id": "right", "name": "右侧", "image": "/assets/characters/ho-olheyak-trophy-gallery-right-subject.png" }
    ],
    "closeups": [
      { "id": "face", "name": "沉静的面容", "x": 50, "y": 16, "image": "/assets/characters/ho-olheyak-trophy-detail-face.png", "description": "死亡追上她前的最后一秒，她的目光投向一直以来渴慕的天空，但她的眼神此刻与她追求的辽阔天空般同样充斥着虚无，接下来她看见什么，就是你决定的了" },
      { "id": "chest-costume", "name": "礼服胸饰", "x": 50, "y": 31, "image": "/assets/characters/ho-olheyak-trophy-detail-chest-costume.png", "description": "胸前的紧身衣为了吸引注意力而在设计时特意留出的缝隙，其仍在忠实地发挥着它的作用，展示着主人那一对深邃的胸怀" },
      { "id": "upper-hem", "name": "收束裙摆", "x": 50, "y": 55, "image": "/assets/characters/ho-olheyak-trophy-detail-upper-hem.png", "description": "她的生命也如她那饱满强健的大腿曲线般被陡然收束，接下来留给你的便只有形同虚设的秘密，本是出于体面的装束，并不方便大步跑动，但现在你可以好心地为她迈开双腿，感受着生与死的飞跃" },
      {
        "id": "shoes",
        "name": "鞋履",
        "x": 50,
        "y": 88,
        "image": "/assets/characters/ho-olheyak-trophy-detail-shoes.png",
        "description": "精致的短跟小皮鞋与黑色高D丝袜的完美搭配，为了一个执念而奔波不息的部位，时间给予了它浓厚的沉淀，脱掉它，享受胜利者的果实",
        "variants": [
          {
            "image": "/assets/characters/ho-olheyak-trophy-detail-shoes-p1.png",
            "description": "褪去精致的包装后，胜利的滋味是如此的浓郁且芳香，它们的形状是如此的秀丽，十指甚至还涂上了艳丽的指甲油，也许她仍有自己那爱美的私心，也许只是为了达成目标而勾引他人，无所谓，她本可以享受生命，但她现在正安详地躺在你的面前"
          }
        ]
      }
    ]
  },
  "revolverPlacement": { "top": 140, "left": 124, "mobileTop": 110, "mobileLeft": 112 },
  "ai": { "P": 0, "A": 1, "B": 1, "C": 1 },
  "aiSkills": [
    { "definitionId": "ho-olheyak-inheritance-terminal", "enabled": true, "parameters": {} },
    { "definitionId": "ho-olheyak-once-had-wings", "enabled": true, "parameters": {} }
  ],
  "dialogue": {
    "MATCH_START": ["诚挚的建议，不要把表情写在脸上，不然总会被人看出破绽", "怎么？我笑起来不好看吗？还是说，只是因为我一直在笑？不必在意，我只是有些自信罢了", "将面部表情全都变成紧盯着我的脸，这种战术不错，可惜我的脸上也没有什么，也许你只能找得到我对胜利到来的喜悦", "抓好自己的牌，命运的牌桌前你我都是献祭的祭品，只有谁被笑纳这个区别"],
    "PLAYER_HIT": ["充满勇气的行为，但您怎么知道，这张牌一定是您想要的呢？", "哇哦，不错的选择，但是您真的不会爆牌吗？", "您选择继续跟进，是啊，我们都拥有着一样的贪心，否则不会在这里见面", "继续要牌吗？炎国有句俗语，人心不足～蛇～吞～象～哈哈，这句话说的好像对我很有利一样"],
    "PLAYER_STAND": ["明智的选择，我的短暂的生命中由于对方的贪婪而使我获得的胜利不在少数", "这时候停牌的确不错，在我的记忆中，这种警示案例实在是太多", "命运只会吞下懦弱之人当做祭品，我已经没有什么可以失去的了，想想你自己", "真的要在此停下吗？说不定我的下一张牌就会比你更靠近2～1～点～呢"],
    "OPPONENT_FIRST_HIT": ["哎呀，再多要一张我就会被子弹打穿脑袋呢", "命运面前，我们都是一无所有，只能拿出充足的准备和全部的勇气来，当然，可以添上一点点的运气", "猜猜看，是我的牌硬，还是你的子弹硬", "我们能传承至今，靠的可不是当缩头乌龟"],
    "OPPONENT_FIRST_STAND": ["见好就收是我总能得渔人之利的经典守则，我可不想用自己的脑袋和子弹比比谁硬", "我已经21点了，你就是再跟牌也只能输下这盘或是与我平局了，怎么样，好好考虑一下？", "输的风险我可担当不起，所以您还要继续加牌吗？毕竟多跟一张，赢面可能越大呢", "看起来我手里这几张牌有够烂的呢，再多一张牌就是多一份风险"],
    "OPPONENT_REPEAT_HIT_AFTER_PLAYER_STAND": ["哎呀，局势开始对我有些不利了呢，您真的以为凭借您手里那副牌就可以稳坐钓鱼台了？我至少可有追平您的信心呢", "为了得到我想得到的，我可不介意冒上一些微不足道的风险，倒是您，真的相信自己手里的那副牌吗？", "您可以期待我的脑袋被子弹打穿以后的模样了，不过您真的止步于此便满足了吗？"],
    "PLAYER_BLACKJACK": ["呵呵，别急着高兴，在枪响之前，一切还是未知数呢", "命运啊…你竟然选择把我吞下…", "经验之谈，除非看见了我这一身媚肉栽在椅子里抽搐，否则还是不要急着开香槟呢"],
    "OPPONENT_BLACKJACK": ["哇哦，命运女神终归还是眷顾于我的，不过在枪响之前，我可不会高兴", "需要我为您装填子弹吗？毕竟可能是最后一次了，这样有意义的事让我来也是无可厚非的吧", "这次的牌不错，怎么样？有没有被吓到想要认输了？现在还不晚哦"],
    "PLAYER_BUST": ["人心不足～蛇～吞～象～，贪心不足吃月亮。您这头巨象也是被命运吞入口中了呢", "也许是您并没有我这般丰富的知识沉淀，并不知晓贪婪的代价呢", "当然，您若是愿意，可以来到我的胸脯里开这一枪呢，毕竟安抚失败者也是胜利者大度的展现"],
    "OPPONENT_BUST": ["人心不足…蛇吞象…哈…没想到这次被吞下的居然是我啊…", "不能在这种地方展露出来自己的软弱…还是需要注射那种药物…", "我早该知道的…也许当初…哈哈，不过愿赌服输罢了，枪响之前，谁是赢家还不一定呢"],
    "PLAYER_WIN_ROUND": ["恭喜恭喜，要亲自对我开枪吗？这可是一份殊荣呢，不过我也很期待在你脸上看见落寞的神情了！哈哈哈！", "哇哦，看起来是你赢了呢，不过在子弹打穿我的脑袋之前，我可不会手软的哦", "也许您当时再多要一张牌，会胜的更漂亮一点呢，咯咯咯"],
    "OPPONENT_WIN_ROUND": ["欣赏您的神情也是胜利者的权力之一，别拘束，将您的恐惧全数展现给我看吧！", "怎么？需要我把您抱进怀里哄哄您，您才肯开枪吗？咯咯咯", "您放心，您的一切表情都会永世铭刻在我的记忆中，为我族群的记忆而永世流传下去，哈哈哈！"],
    "PUSH_ROUND": ["究竟是你的侥幸还是我的侥幸呢？…", "充满了趣味却毫无意义的对局呢，怎么样，要继续吗？", "我可真走运，或者说，你可真走运，不过下次命运就不一定会这样雨露均沾了"],
    "SPECIAL_TWENTY_ONE_PUSH": ["哈哈，可真是难得啊，遇见和我想的一样的人！不过下一次你真的还有勇气这样做了吗？"],
    "SPECIAL_LOW_PUSH": ["哈哈，原来根本诈不到你啊，还以为你是什么很激进的人呢", "怎么样，现在我们都有资格嘲笑对方的懦弱了", "被看破了吗？还是说，您生性如此？"],
    "PLAYER_TRIGGER_READY": ["哦哦，请容我坐直了身子观看，毕竟这可能是最后一枪了", "怎么样？要不要赌你的一张牌，这枪是空枪，赌赢了的话你可得给我一张牌", "别紧张，毕竟枪口对准的不是你的脑袋，不是吗？哈哈"],
    "OPPONENT_TRIGGER_READY": ["稍等，让我注射好这管药物，至少它能让我…呵呵，我也在你面前露怯了啊", "无非两种结果，赢了或者输了，输了我归你，赢了嘛…那就…", "可以不要打脑袋吗？毕竟那地方虽然带给我不少痛苦，可也算我为数不多值得骄傲的地方之一，你看我的胸怎么样？"],
    "PLAYER_SURVIVED_TRIGGER": ["哇哦，不出所料，可喜可贺，那，我们继续？", "不错，您展现了您的价值，但是接下来您可不会那么走运", "哎呀，真让人惋惜呢，也许子弹就在相邻的弹巢里，不过无所谓，下一次就不一定了"],
    "OPPONENT_SURVIVED_TRIGGER": ["呼…啊…还好那管药物生效了，我才不至于在您面前失态", "真令您感到惋惜，对吧，我还活生生地坐在这里，没有栽歪在椅子里成为您的收藏", "一如既往，这种情况我见得多了，才不会在您面前露怯呢"],
    "PLAYER_TRIGGER_HIT": ["呵呵，看起来胜利的果实属于谁已经显而易见了呢，希望您能履行和我的赌约", "终于…完成了吗？这是真的吗？哈哈，我都有点不敢相信了，竟然这么轻易就…解决了", "看吧，哪怕到了牌桌上，我也是依然承袭了祖辈的荣光"],
    "OPPONENT_TRIGGER_HIT": ["天空…望见…命运", "献祭的…祭品…是我啊…咕…", "脑子…流出来…不要…不要丢", "里面都是…荣耀…不能…忘记…", "传承…到此为止了吗…命运…无趣…"]
  }
}
